{
  "schemaVersion": 2,
  "contract": "platform.node-runtime-compatibility/v2",
  "migration": {
    "productionDefault": "Node 26.11.1 is the owner-authorized repository default; Node 24 remains an explicit compatibility lane.",
    "node25Policy": "SKIPPED",
    "cutover": {
      "status": "AUTHORIZED",
      "requiresOfficialLts": false,
      "requiresOwnerAuthorization": true
    }
  },
  "platform": {
    "engine": ">=24.21.0 <25 || >=26.11.1 <27",
    "productionVersion": "26.11.1",
    "candidateVersion": "26.11.1",
    "skippedVersion": "25.0.0"
  },
  "qualification": {
    "targetVersion": "26.11.1",
    "status": "IMPLEMENTED_PENDING_QUALIFICATION",
    "strictInstall": "READY_FOR_STRICT_INSTALL",
    "apiAudit": "IMPLEMENTED",
    "focusedCi": "IMPLEMENTED"
  },
  "nodeApis": [
    "node:assert/strict",
    "node:child_process",
    "node:crypto",
    "node:fs",
    "node:fs/promises",
    "node:os",
    "node:path",
    "node:test",
    "node:url",
    "node:util"
  ],
  "upstreamDependencies": {
    "foundation": [
      {
        "name": "@agent-teams/engineering-foundation",
        "version": "1.7.2",
        "relationship": "DIRECT",
        "nodeEngine": "^24.18.0 || ^26.0.0",
        "node26StrictInstall": "SUPPORTED",
        "role": "DEVELOPMENT_TOOLING",
        "integrity": "sha512-2wmq4g8rWgXQ2qBVY2Tb7HVP9LFsuBAUMcDhgCqixLA0RA9H3OrwXy7b7jK2gS6SggK9XCplNb03mVLR2EyzRg==",
        "lockIdentity": "@agent-teams/engineering-foundation@1.7.2(@types/node@24.13.3)"
      },
      {
        "name": "@agent-teams/docs-protocol",
        "version": "0.6.2",
        "relationship": "DIRECT",
        "nodeEngine": "^24.18.0 || ^26.0.0",
        "node26StrictInstall": "SUPPORTED",
        "role": "DEVELOPMENT_TOOLING",
        "integrity": "sha512-kqE4pA9/V/MgbOm2nTyfRWU+CuwtAX6pB6WGQauKvvozwS4CzFfJwARTgd91R3yCf6bi5l/kU+mcAe6WVID7aA==",
        "lockIdentity": "@agent-teams/docs-protocol@0.6.2"
      },
      {
        "name": "@agent-teams/docs-protocol-agent-teams",
        "version": "0.3.2",
        "relationship": "DIRECT",
        "nodeEngine": "^24.18.0 || ^26.0.0",
        "node26StrictInstall": "SUPPORTED",
        "role": "MANAGED_DOCS_ADAPTER",
        "integrity": "sha512-JgNRR4x+3ckfzCqadNEJrqIwdZ7Lz1p981sWcqDObviWoK5hmOwu13v8/PO03d1WWUdnunDp8T95PnRbuYfjiQ==",
        "lockIdentity": "@agent-teams/docs-protocol-agent-teams@0.3.2"
      },
      {
        "name": "@agent-teams/document-authoring",
        "version": "0.3.2",
        "relationship": "TRANSITIVE",
        "nodeEngine": "^24.18.0 || ^26.0.0",
        "node26StrictInstall": "SUPPORTED",
        "role": "DEVELOPMENT_TOOLING_LIBRARY",
        "integrity": "sha512-GzdetjP25KJfThxNk7UhtAZ28rOb6T/rTRrjYSrp2rYaEt0do5XF4pGjIVdeSzh+zXH0ULu58TZsuhOJi0Q0Mw==",
        "lockIdentity": "@agent-teams/document-authoring@0.3.2"
      },
      {
        "name": "@agent-teams/repository-mutation",
        "version": "0.2.2",
        "relationship": "TRANSITIVE",
        "nodeEngine": "^24.18.0 || ^26.0.0",
        "node26StrictInstall": "SUPPORTED",
        "role": "DEVELOPMENT_TOOLING_LIBRARY",
        "integrity": "sha512-4G6kkQKA7ua4z9mxxn1XNrBUgngWeQ+UufDnQ34YdYv26DZi1/pUYwGoKajFluhUNDXhvqf4fMJQu0nI6m6jdg==",
        "lockIdentity": "@agent-teams/repository-mutation@0.2.2"
      }
    ],
    "runtime": []
  },
  "privatePackages": [
    {
      "name": "@agent-teams/platform-project-management",
      "version": "0.0.0",
      "runtimeDependencies": []
    }
  ],
  "managedDocsRuntime": {
    "package": "@agent-teams/docs-protocol-agent-teams",
    "policySource": "@agent-teams/docs-protocol-agent-teams/schemas/qualified-docs-cohort/v2.schema.json",
    "authority": "CENTRAL_DOCS_COHORT",
    "nodeEngine": ">=24.18.0 <25",
    "pnpmEngine": ">=11.17.0 <12",
    "node26Qualification": "NOT_QUALIFIED",
    "cohortUpgrade": "NOT_AUTHORIZED_BY_PACKAGE_ENGINE"
  }
}
